video_id,title,likes,views,published_date
4krBgDFycgY,7k SUBS! Smashing Ghost + AW! Plus Channel Talk!,3225,93834,2015-09-09T21:48:18Z
dpUxRIqbNlc,Exility vs Dr.Pineapplez - Misleading Contest!,4586,60579,2015-09-08T22:06:36Z
Cp431S5z8PE,6 Uses For Your Advanced Warfare Disk!,2176,60586,2015-09-07T20:40:56Z
ttLYXcza4j4,MrBeast’s Outro Song,388074,8716021,2015-09-05T20:15:02Z
3-f9DEFsh4w,Watching Video Games Is A Waste Of Time????,2000,60819,2015-09-05T16:14:19Z
vuOTP206zWM,Pewdiepie's Shoutout What Would You Do If You Won?,2149,60621,2015-09-05T00:49:25Z
J590MYm0SY8,How I Will Survive The Zombie Apocalypse!,6825,240888,2015-08-31T22:11:06Z
vGB2d5cQJpY,How Much Money Do Youtubers Make? Real Numbers!,12090,439553,2015-08-30T21:37:55Z
M94G0iKYiSM,HONEST Shout Out Sunday! Free Subscribers!,1864,60597,2015-08-30T18:06:45Z
pGYyUssWLTA,Social Media As A Job????,2225,60578,2015-08-29T18:20:31Z
j7kM8G_AjuY,Airplane Pilots Last Words Before Death,2803,155198,2015-08-28T21:56:21Z
deK-My3Of0o,How Much Do T.V. Commercials Cost?????,1641,60713,2015-08-28T01:40:10Z
oB8kFFvJdhE,How To Tweet When You're Dead! DEADSOCIAL Facebook And Instagram Also!,1975,60706,2015-08-27T10:00:01Z
X9eXa-Uzuj0,My Favorite FaZe Clan Members?????,1825,62779,2015-08-26T10:00:00Z
GxTVDClFXuc,MrBeast6000Subs,56261,916307,2015-08-23T11:00:00Z
kGaq-Qi9hoE,Youtube Networking - Aka Fake Likes Subs And Comments,3216,76257,2015-08-21T20:04:55Z
9zFfp3gzZ88,I Hate Youtubers That Ask For Likes,11258,223486,2015-08-20T19:13:03Z
mM2KwBYa-u4,My Mom Found My Channel!! :0,26203,790705,2015-08-20T01:44:22Z
WAcmsAISniQ,1080p FREE TO USE BLACK OPS 3 GAMEPLAY,1929,87186,2015-08-19T21:35:16Z
kqUT-s3a6tU,Black Ops 3 First Impressions My First Game,1741,60606,2015-08-19T02:44:52Z
NUVglXbGBfs,Dogs Opinions On Youtubers Getting BO3 Early,3143,107805,2015-08-18T20:55:37Z
T-v4b3WtPAg,BO3,36428,1452657,2015-08-18T17:07:49Z
m8qGlpcfAIw,Xbox One Destroyer? COD Advertisement Is Free,1736,61207,2015-08-18T01:08:14Z
uZPkMnv8b-o,Modern Art Is A Joke,2000,69479,2015-08-15T10:00:01Z
qVLr6SMxvJw,5 Steps To Becoming Successful On Youtube!,3665,92382,2015-08-14T10:00:03Z
4AigP5OY8JE,Time,2264,98945,2015-08-13T10:00:00Z
RMoFUeBVefA,Beast $500ish Youtube PC Great For Making Videos!,1620,89651,2015-08-12T10:00:00Z
ep7S1XnuQLU,5000 Hype,3571,166245,2015-08-11T10:00:00Z
p6bzNpgbX8Y,What Is Crohns Disease?????,7401,303003,2015-08-10T10:00:01Z
6T17licWsQ4,Leaving For 7 Days,1519,62172,2015-08-09T14:26:58Z
1s6UOlWdpw4,Motivation For Youtube - Ultimate Small Youtuber Motivation #2,7624,206481,2015-08-08T22:15:43Z
3LuchpUc7PU,Should I Buy An Elgato Game Capture??,2132,60594,2015-08-07T10:00:00Z
_f6xCA0-gAo,Fanboy Opinions On Black Ops 3,1448,60601,2015-08-06T00:58:47Z
lfD7kMZKuNg,Big Channel's Starting Over???,1624,60613,2015-08-05T10:00:02Z
ejlkNGm82w4,SAT And Some Random Stuff,1773,60588,2015-08-04T22:14:13Z
Jtj9rUqlB1Y,How Many Youtubers Are Millionaires???,2033,127773,2015-08-04T00:18:58Z
ZqzFRGH_tMQ,Always Changing My Name? Mr.Beast or MrBeast6000,4506,191115,2015-08-03T10:00:03Z
94A-bsumX9A,How Much Youtube Money Do I Make???,10436,446238,2015-08-03T02:19:22Z
gYaxI_allkQ,Am I Ian From Smosh????,14172,1154895,2015-08-02T19:09:03Z
AjXbO2XfBkE,How Do You Turn Off A PS4? Xbox Noob In Need Of Help,2181,104627,2015-08-01T21:51:25Z
ZQZzR0DUujc,New Optic Gaming Gear Coming To Advanced Warfare My Thoughts,1865,60632,2015-08-01T16:47:55Z
-V3-fhJQZkk,Youtube Collabs? Collabbing with Mr.Beast?,2271,117630,2015-08-01T10:00:01Z
QX0wvWGW2qg,Sacrifices And Youtube,2762,60584,2015-07-31T18:03:32Z
oODUkNQAzXU,5$ To Advertise Your Youtube Channel???,3162,178694,2015-07-31T00:13:08Z
2jWZtKTN6jU,Reuploading Other Youtubers Videos? Stealing Big Youtubers Videos.,1571,60777,2015-07-30T18:23:18Z
zsADECFHY8w,4k Subscriber's! First Channel Story!,3265,115705,2015-07-30T01:56:38Z
Feh8o-HmthM,People Who Got Rich From Movie Trailers On Youtube,1694,105896,2015-07-29T19:00:00Z
6Xv-LVYZQxk,Beast Gaming Set Up #almost4k,2543,93312,2015-07-29T15:31:24Z
8-0ZHJHp9g4,Advanced Warfare DLC 4 Honest Parody,1685,60876,2015-07-29T00:37:21Z
QqIG0R-KpGk,World's Worst Thieves,2221,101305,2015-07-28T17:17:48Z
qENpZBzgaUM,VANOSSGAMING IS IN TROUBLE,4029,260118,2015-07-27T22:13:05Z
4DYBVA4884Y,SpiderMan Robs Walmart?????,1677,60581,2015-07-26T19:21:24Z
skEf9R0TXkM,My Upload For ThunderstruckGaming,1508,60615,2015-07-25T22:35:54Z
CnMv_zTXZ38,Best FNAF 4 Fake Reactions! So Funny lol,2793,94971,2015-07-25T16:38:00Z
bEIK5ni_Pzs,How Many People Get The Diamond Play Button?????,18542,1820294,2015-07-25T10:00:03Z
_oZyp4mTzSQ,Supply Drops For Charity! Ep #2,2273,60601,2015-07-24T10:00:00Z
is1LSWbssuA,Best Thing To Happen To This Channel?????,1901,60580,2015-07-23T10:00:00Z
XR_q9_LEKuc,Supply Drop Challenge For Charity,2359,60575,2015-07-22T17:59:43Z
X9UiBpDHW3w,FaZe Clan Vs Pewdiepie Who Would Win?????,1280,72604,2015-07-21T18:51:04Z
PRU47AuQF2M,"FaZe Adapt ""Stuttertage""",3354,124972,2015-07-20T17:49:03Z
Y3Rxgf5_R_I,The COD Community? Sleeping With Your Mom?,1921,60591,2015-07-19T17:37:51Z
R6zuvKbvKyU,Exility And Some Other Stuff - Update Vid,11466,60600,2015-07-18T18:02:27Z
yCKe65Nvp0Q,Every Minecraft Let's Play Ever In Under A Minute,3815,126903,2015-07-16T22:00:01Z
XBe57FyB2xU,Why I deleted Today's First Upload,1575,66083,2015-07-16T17:03:16Z
zpCwHwWgbsI,What Is Spam404?????,1445,60592,2015-07-15T15:05:18Z
lh61MVUxJt0,The History Of Pewdiepie In 2 Minutes,7351,266412,2015-07-14T10:00:01Z
yWnmEPgLroQ,TWITCH STREAMERS REACT TO RECEIVING THOUSANDS FROM SAME GUY!,2267,223928,2015-07-13T10:00:01Z
eBklqeeIu10,I Hate Spam On Youtube,1997,60577,2015-07-12T19:08:52Z
SgMydsOucFg,INSANE TRIPLE LEGENDARY SUPPLY DROP! BEST OPENING YET?,0,61094,2015-07-11T20:08:50Z
jPm3hRiMKuU,Low Bridge Causes Dozen's Of Wrecks! 11-8 Bridge,2254,60579,2015-07-10T21:56:20Z
OweuuinkVZI,3k HYPE,4712,163679,2015-07-10T18:05:46Z
7Pr0HP-Trgk,How To Become A Gaming Youtuber! All You Need To Know!,2120,60587,2015-07-08T22:00:01Z
UEK0fYAqMss,My Solution For The Theft At The FaZe House - @FaZe_Rain @FaZeAdapt,1323,60759,2015-07-08T10:00:00Z
lRznKN2oPUc,5 Popular Channels That Were Terminated,4536,139243,2015-07-07T22:00:00Z
IDrS_TrjuK4,What Is Youtube Terms Of Service?????,1425,62200,2015-07-07T10:00:00Z
J1lhxfZtR3M,Do You Think You Will Be Famous?????,3310,156814,2015-07-06T22:00:01Z
b_o8cz0ZNdk,What Is Swatting? Why I hate It!,2454,102036,2015-07-05T18:08:37Z
i5dhcAxO25Q,Reddit Is In Chaos After Firing Victoria,1188,65273,2015-07-03T20:11:21Z
-o_8CDbFMJ0,Paid Promotion On Youtube Good?,1252,63585,2015-07-03T19:26:09Z
v5J1Cycn3s8,How To Gain Youtube Success,3299,97008,2015-07-02T17:10:49Z
YJiqYG-Mylk,FaZe Members Reaction's To Joining Faze,13810,621617,2015-07-01T19:56:45Z
jGE1sUTeR5g,Battle of The Beasts Round 2 Winners!,1508,60664,2015-07-01T04:02:27Z
0tZCQ25fsoI,Youtube In 10 Years?????,109277,1536321,2015-06-30T16:31:29Z
N9jTogPwqVY,The Ultimate Motivation For Small Youtubers,16425,317995,2015-06-29T17:27:21Z
yyJ7xEcENNI,How Much Does Pewdiepie Make?,3314,268764,2015-06-28T22:41:05Z
3rJgCGMPEqA,Random Stuff You Don't Care About,2205,60616,2015-06-27T23:32:54Z
7isfkomGg7o,Battle Of The Beast Round 1 Winners!,1581,60590,2015-06-23T19:49:57Z
UCYefSGBP00,The Truth About Big Community Channels,2132,60597,2015-06-22T16:32:02Z
dvdGkRK5a_0,WORLD'S FIRST BLACK OPS 3 GUN SYNC!!,1709,74234,2015-06-22T01:19:49Z
X7doE4h6W64,Insane Gun Sync - 7 Hours To Make,2266,60576,2015-06-21T12:22:34Z
GhppzOzN3MM,Battle of The Beasts Bracket!!!! (Not accepting anymore),1584,60590,2015-06-20T03:32:30Z
QkXDatNdL4U,Free To Use Advanced Warfare Gameplay! 2015,1690,60581,2015-06-19T14:07:22Z
hyt2t4r8lQ4,Battle Of The Beast Tournament UPDATE!,1961,60580,2015-06-18T23:25:47Z
-mlok5iT3GE,My Top 5 Favorite Things At E3 2015,1830,60585,2015-06-18T17:18:38Z
STvOHHgJ1sQ,Battle Of The Beasts (youtubers needed),1525,60585,2015-06-17T20:58:19Z
2-ErX5oDzwM,History Of COD Part 2! Black Ops 1 - History Of COD On Youtube!,1332,60694,2015-06-13T21:34:28Z
7ytYV-tVIvg,How Did Notch Become A Billionaire? How Much Did Minecraft Sell For?????,2787,121445,2015-06-12T17:47:14Z
ELIoOUKSOJQ,Top 10 Richest Gaming Youtubers?????,7915,274780,2015-06-11T16:42:11Z
uAoayezOaug,Markiplier Is A Great Man! Sub shodleech!,2316,228471,2015-06-09T02:56:28Z
Vr2337tCLCI,Insane Advanced Warfare Hacker!,1880,60580,2015-06-07T22:58:31Z
NV7qmqbS8tM,"What Is Considered A ""Bad Video"" On Youtube????? #karnageRC",1554,79485,2015-06-07T21:38:42Z
U9c-ycvw02A,I Think I Am Going For The #KarnageRC,1951,60589,2015-06-05T15:21:50Z
GfgcVOuHLAo,Every FaZe Video Ever #karnageRC,1826,60595,2015-06-04T19:09:17Z
zi7tZ-2PhLk,How Much Money Do You Make As An Uber Driver??????,1372,60755,2015-05-31T18:31:25Z
TacjQmKCiZg,How Much Does Faze Rain's Giveaway Cost??????,1620,60589,2015-05-30T21:27:08Z
AIytwdufwW8,MY MESSAGE TO COD YOUTUBERS (Watch till end plz),1468,61416,2015-05-29T20:07:48Z
KLAI0c0Spog,Best Of FlipArtz - His Best Advanced Supply Drops EVER!,1462,129225,2015-05-29T17:06:25Z
UVin8WtE5eU,Summer Is Finally Here!,1265,65322,2015-05-28T21:46:37Z
wNuxirsrwBk,Why Are Things Unbalanced In Video Games?????,1412,99003,2015-05-28T20:36:06Z
6bxZpS0cm5o,New Channel?,4314,173072,2015-05-23T22:59:21Z
ajJbMGq9AS4,"Youtube ""Freinds""",1637,105414,2015-05-23T01:28:10Z
UXw9jqgJNNc,Youtube Stat News - Vevo Gets 10 Bil. Views A Month Channel Milestones and more!,2420,60592,2015-05-21T00:31:22Z
E3CqKvlzl-I,Big Changes??? Idk just watch the stupid video,1814,60602,2015-05-18T21:29:43Z
zfDr05ax0gM,How Much Money Does DramaAlert Make????,1892,60587,2015-05-15T23:53:16Z
56OkH6ocYZU,L0114R - Biblical Creeper Post for Post @L0114R,1269,61073,2015-05-15T16:48:54Z
w40Z8aT5fpQ,Why Do We Do Things That Are Bad For Us?????,1857,60608,2015-05-14T23:52:57Z
zgDezsMQyyU,How To Monetize Your Videos And Make Lots Of Youtube Money!!$$$,1692,60979,2015-05-10T20:59:50Z
UEwnitHoSDw,DIY $23.00 Mini Sound Booth? Does It Work?,2803,156148,2015-05-09T19:47:51Z
__SaaKSW9iE,Cut Coms vs Uncut Coms,1553,60610,2015-05-09T06:53:13Z
qWnyJ55KBKo,Minimum Wage,1707,79282,2015-05-07T23:27:32Z
52awie9G00A,My New Channel Trailer ;),1757,67121,2015-05-07T01:27:48Z
bB99NdUoxEQ,Why I Changed My Channel Name,3721,150731,2015-05-03T23:59:54Z
7GjSaNi8Epg,How Overpriced Is Movie Popcorn?????,1592,60616,2015-05-03T18:39:15Z
h5uE4ERMiTk,Screw Warface,1571,60574,2015-05-02T21:41:18Z
umRLkCrmwcs,My Problems,2058,77745,2015-05-01T02:23:50Z
rHoLyltYDtQ,Ma Channel,1678,60810,2015-04-29T23:50:00Z
yeHjsYQ076A,Remember When COD Was Fun?,1783,60575,2015-04-26T21:26:36Z
pqrdPu2ESFo,My Baby Got a Virus :(,1722,82964,2015-04-25T22:34:19Z
ywZy_Fo2ydo,Modern Art Is A Joke,1573,60804,2015-04-25T15:02:30Z
qr4v9pdfVlU,Cheat Channels,1726,60641,2015-04-24T01:53:38Z
hgiPX33AHas,Time,1834,93315,2015-04-22T21:33:54Z
oZ-Mn5p1xMw,2000 Subscribers,22377,423891,2015-04-18T18:45:34Z
5UPa_hu5opg,Youtube,2384,104090,2015-04-14T22:39:24Z
zv_oq5UNDAo,How To SAT Get Into Yale,1375,62031,2015-04-13T11:08:02Z
NiqkH7qVW0U,100k Subs With No Videos????,9625,491802,2015-04-11T16:51:40Z
boBokLXe5o8,Is Jacksepticeye A Millionaire?????? 2016,3646,233335,2015-04-09T23:07:38Z
7YOzgk-U4EU,How Rich Is Buzz Feed???,1191,75222,2015-04-07T11:16:50Z
prdSftLj9-g,How To Do A High School or College Paper!,1933,105164,2015-04-06T11:42:14Z
pzlPJmNyepA,What is Crohn's Disease?????,18387,542731,2015-04-04T20:31:25Z
QNoqAnJOSqU,What Happens If You Get A Copy Right Strike??,4558,184086,2015-04-03T19:45:11Z
kzIA4vKyhRQ,5 Steps To Becoming Successful On Youtube,8671,198163,2015-04-02T23:10:02Z
DfonKqMENrg,Making Youtube a Priority,1779,67490,2015-04-01T23:58:35Z
MUQCwdkEbq0,Why I Was Not Uploading,1345,62912,2015-03-21T22:11:51Z
JlUzoQN9FWw,Youtubers Analytic's Explained,1528,65290,2015-03-06T01:07:06Z
0VjLq-go1fg,How Much $$$ Does Every Member of FaZe Make COMBINED????? 2016,1724,110849,2015-03-05T02:07:01Z
uCIpW9zOmgI,Is Pewdiepie The #2 Youtuber?!?!?  :0,1829,97107,2015-03-04T01:53:50Z
Z0Poefgrs4w,How Much Money Does Smosh Make????? 2016,1424,82142,2015-03-03T01:14:27Z
MLN6TRB9Jxw,Who Are The Worst Youtubers?????,4329,282993,2015-03-01T12:00:00Z
vZrL_FFITgs,Subscriber Goals For 2016,1570,61661,2015-02-28T17:12:07Z
L7lGD_anC00,How Many People Do Youtube as a JOB?????,1527,61742,2015-02-26T02:07:13Z
xu1nhAfnMGA,How Much Money Does Syndicate Project Make????? 2016,1234,93975,2015-02-24T20:26:12Z
D1livXdFGkQ,Are Youtubers Millionaires?,3517,204561,2015-02-22T19:45:00Z
bwp_3qLgWpQ,Magecraft - Epic Hit! 11k Troops killed.,1506,60747,2015-02-21T15:41:14Z
tZpnfF0-7Ls,Highest Paid Musicians????,2243,149509,2015-02-17T21:38:06Z
BwAMltY3-c0,Making Fun Of Youtuber's Intros.,7643,323410,2015-02-16T19:45:42Z
7HBR3Ea72CY,10 Things You DIDN'T Know About Youtube!,1691,77103,2015-02-08T00:04:06Z
Ds9H2UnUHL0,Quitting?,4910,140808,2015-02-06T22:27:38Z
iqUFeWAVp-0,How Much Money Does Markiplier Make????? 2016,2302,150706,2015-01-04T20:59:46Z
W2skFWRk6qo,PewDiePie Uploads A Fake Video! LOL,1628,89523,2015-01-01T18:56:04Z
X_qd-1xSTFA,Pewdiepie Was On T.V.,3547,164711,2014-12-07T17:51:08Z
VWa0ImMY2bQ,Five Facts You Didn't Know About Youtube.,2193,107986,2014-12-01T22:00:05Z
fEcASr38n2E,Milestones And Plans For My Channel,1805,78441,2014-11-30T18:21:44Z
udmf5MQLNGA,How Much Money Did Gangnam Style Earn??? 2016,2070,111338,2014-11-26T22:53:11Z
0dg2eR2NSQ0,Best League Player In The Universe.,17097,328726,2014-11-23T17:37:28Z
6BNOWeYFyP8,MageCraft - Beginners tutorial. (The app),1378,61428,2014-11-17T02:25:46Z
LDegY-H60_U,How much money does VanossGaming Make? 2016,4831,361148,2014-11-02T16:06:08Z
D51HaR-XvgM,Opening Old Basketball Cards! Ep. #1 (Michael Jordan Found),4197,206825,2014-10-21T02:19:05Z
Rio7r_vLUEo,20 Best Websites?????,3667,203412,2014-08-29T22:45:20Z
8E5Ygl02wtM,"How Much Money Does ""Chris Smooth"" Make?????",1350,78926,2014-08-21T22:46:35Z
moMJjt5KECc,Money Problems,5349,308076,2014-08-20T17:40:18Z
OffgqPzDi7Q,Vanoss vs Speedy! Who is better? Updated.,1634,60789,2014-08-20T01:57:30Z
B_7uD3B62MM,Welcome To My Channel!,2051,87565,2014-08-18T00:01:52Z
bA20RJcegOI,1500,9316,329793,2014-08-08T18:58:18Z
NbHwVDt9Rjk,How Much Money Does Yogscast Make????? 2016,1157,61689,2014-07-13T18:37:22Z
VzsE09KjpKA,How Much Does WhiteBoy7thSt Make????? 2016,2990,337284,2014-07-11T21:52:50Z
HduubRTdko4,"How Much Does ""Epic Rap Battles"" Make?????",1603,60577,2014-07-10T23:05:51Z
qFOGv5zuTdw,How Much Money Does FaZe Make?????,1726,60594,2014-07-09T21:15:15Z
u6t4jrhs56Q,"Top Youtube ""ShoutOuts""",2005,60574,2014-07-09T00:07:05Z
460GXJiGCEs,Youtube Dream,2375,81433,2014-07-08T00:17:34Z
ZiuoOcj2eLY,In Dis Video I Play Minecraft. (Factions),1757,62429,2014-07-05T15:57:13Z
LYK6SPMtJ_Y,Youtube Grind,3019,125013,2014-06-28T21:06:46Z
2ljWxaMvE_0,Hacker in Ghost???? I Couldn't Kill Him.,1768,60594,2014-06-22T00:27:19Z
rSuuQ_s8gOw,How Much Money Does Tmartn Make?????,1801,60606,2014-06-21T18:43:51Z
vKKhX-Uyggw,How Much Money Does FaZe Rain Make?????,1483,73427,2014-06-18T14:00:09Z
EAwXH82m-6A,G2g Brb,1879,60592,2014-06-16T14:00:07Z
U_07AG_CR5A,Crazy Nub Tub Reactions! Bo2 Fun!,1812,60582,2014-06-13T22:44:22Z
Xe0AGtF5aNU,Fun In COD. - Insane Reactions Lol,1869,60590,2014-06-10T19:01:43Z
NCv0drAPm_M,Minecraft Build-off Fun!!!!!,2061,78346,2014-06-09T12:00:07Z
HuLAAXZXIy0,This Kid Should Quit COD....,1705,85185,2014-06-02T21:37:07Z
pV7UcYW1OwA,Computer vs Console My Perspective.,2432,114635,2014-06-02T18:08:34Z
x4IXCimma-s,5 Youtubers I Think Will Be Famous...,5891,243775,2014-05-31T21:06:55Z
anZbhN0Wh_4,How Much Does PewDiePie Make????? 2016,6045,439933,2014-05-24T19:33:12Z
3Q3pQmzWyZM,I Got Really Really Really Bored....,1814,61753,2014-05-24T16:37:13Z
BqS4iVHa-LU,How Much Money Does Penguinz0 Make????? 2016,3233,100751,2014-05-16T23:53:55Z
zX04jQFKCpo,How Much Money Does CaptainSparkles Make????? 2016,7742,819572,2014-05-15T20:36:54Z
G7Y9ban7b0U,How Much Money Does Tobuscus Make?????,1532,77051,2014-05-14T23:06:58Z
EMVvA5Cr0fY,COD IS NOT DEAD,2343,83676,2014-05-08T02:19:42Z
e14MroQ5k_s,Storm,7881,274498,2014-04-30T20:31:15Z
CuzdxsOXEZ8,Hearthstone - All Beards Challenge!,1756,85193,2014-04-24T01:56:43Z
67Wj-0OyKOM,Youtube ad.,10410,563913,2014-04-20T20:26:16Z
LWstCINhd8g,Impossible,2776,90872,2014-04-20T01:45:45Z
dg6iqLCPizs,Motivation,3316,99514,2014-04-17T01:22:40Z
cRPldarzw-M,1k Subs,1276848,17580571,2014-04-13T23:53:33Z
-rdYtmUejSE,Yup I is the best at the game.,5477,299474,2014-04-05T13:00:05Z
tusuuI7MEJU,Should I join FaZe?????,18550,939954,2014-04-04T19:44:52Z
XDe5f8BEvwY,Youtube Networks Requirerments. (Machinima TGN 8byte....),1420,95398,2014-04-01T16:37:55Z
BtCGABBPH9s,Two Years of Youtube.,10168,488124,2014-03-31T16:31:32Z
KJ_C_NSl0P8,"How Much Money Does ""Element Animation"" Make?????",3683,198119,2014-03-30T23:40:18Z
LI8nWXeYtOs,"How Much Money Does ""Skydoesminecraft"" Make????",1695,81755,2014-03-30T01:52:06Z
LMe7k8I082w,Should College Athletes Be Paid?????,2005,93593,2014-03-29T00:18:35Z
h77pHTSPSiw,"""Beast"" Channel Trailer",1907,72799,2014-03-28T21:01:57Z
JUiijjJOInw,What It Takes To Be A Full Time Youtuber...,1961,63651,2014-03-27T19:00:05Z
gpbY6zCEBv4,How Video Games Boosted My SAT Score. Lol,1801,65962,2014-03-26T23:59:45Z
Kgu2ApayYvI,How Much Money Do I Make?????,5012,161126,2014-03-16T01:24:25Z
S9PIukDRcvk,Update,2012,74350,2014-03-13T00:19:29Z
lrw3zkGS9Vc,Subscribers.,3286,118430,2014-03-08T03:52:13Z
IQYW_lVBYGo,How Much Money Does KyR's Speedy's Crew Make?????,2051,104704,2014-03-02T18:14:47Z
iOjxpow6jow,How Many Youtubers Are Millionaries?????,9134,522650,2014-02-26T23:52:57Z
GdD2pqAdjXY,Flappy Bird - Builders Showdown Which is Better?,3318,123812,2014-02-23T22:29:21Z
nmHCmLVLxcU,New COD Zombies In 2014?????,2259,87510,2014-02-23T21:40:04Z
TZPlDuYrcDQ,Minecraft Mansion Timelapse,19900,629207,2014-02-22T23:51:15Z
Oub4nMrNTqQ,Top 5 NON-COPYRIGHTED Songs!!!!!,3547,131885,2014-02-17T20:30:02Z
h5Z36IuyrKc,Vanoss vs Speedy! Which is better?,2789,121649,2014-02-16T20:13:22Z
2IGxSOfsBok,I Hate Pewdiepie!!!!!,225029,3039209,2014-02-01T00:16:57Z
ZxkLCq49Tvk,Does Spam Work?????,7538,490657,2014-01-20T23:41:17Z
smDPnIdlkhM,100th VIDEO SPECIAL!,14713,471205,2014-01-20T01:17:01Z
DjMYkWCEan8,The Vortex SMP Episode 1! Just Derping Around and Explaining Things.,3772,143375,2014-01-18T02:49:24Z
3nn_skHgkqI,Has Youtube Met Its Match?????,2413,114734,2014-01-12T01:25:53Z
A8IkOqb_7Yg,How Much Money Does Pewdiepie Make????? (Updated 2015),29646,2021944,2014-01-11T20:31:34Z
hHl_YMivv3c,Battle Pirates my base.,2052,88964,2013-12-31T14:48:55Z
7mLSbgyjM0g,Battle Pirates Hellstrike Base attack.,2026,78174,2013-12-29T22:22:57Z
TGKkMl17Htg,Battle Pirates Unstoppable Ship!,2348,62741,2013-12-29T21:05:08Z
Qw3eFnsSdlQ,Best Hellstrike Build???? (Battle Pirates),2031,62643,2013-12-29T17:10:57Z
KcNCJ1mgt14,Marauder Builds Battle Pirates In Depth Builds.,2326,62666,2013-12-29T16:20:05Z
A4lp4FRCo6o,Battle pirates How To Auto Lvl 40 Salvages.,2086,66081,2013-12-29T00:32:15Z
WYKZz3Zygdc,Hellstrikes vs 7 halos!,2111,93089,2013-12-27T00:27:31Z
5U2fmvh9_Is,Battle Pirates Hellstrike vs Epic Base!,2050,78504,2013-12-24T00:00:20Z
xvIpibLjs5k,Battle Pirates Another Hellstrike Fail.,2087,77986,2013-12-18T23:47:57Z
jlpAON0ePME,Battle pirates Hellstrike fail!,2064,77817,2013-12-18T22:31:02Z
sfp0a6zDoNQ,Battle Pirates lvl 66 vs Missile Cruiser x Fleet!,2048,79721,2013-12-17T18:56:41Z
RaDRWNz3Al4,Battle Pirates Hellstrike Too Overpowered????,2104,77285,2013-12-14T15:58:11Z
Ms9MGkEm4mg,Battle Pirates All Sentinel Base.,2230,83396,2013-12-05T02:24:33Z
90wWStXJX5c,Battle pirates Lvl 58 Mercury Base Attack!,2569,118614,2013-12-05T01:06:00Z
ruSVy-u2DzM,Battle Pirates Stingray vs Mercury Epic Battle!,2466,81370,2013-12-05T00:00:24Z
pP1KMQb51GA,OpTiC NaDeShOt Got Hack!!,2386,85820,2013-11-27T19:37:44Z
dPxAFqs2eYE,Epic Ghost Multiplayer EasterEggs! (PrisonBreak Sovereign and Flooded),3386,119967,2013-11-17T18:26:11Z
p-KVD5rA_Cw,Why Google Does Not Care What We Think....,7636,472647,2013-11-17T01:40:48Z
JdCgkcb1iwQ,My First Kem Strike!,3296,93375,2013-11-16T19:48:55Z
7anhkLPRk-A,Google+ The Death Of Youtube?????,3562,151835,2013-11-13T22:09:21Z
XVMY7B3AzWM,How Much Money Does PewDiePie Make?????,15595,882459,2013-11-12T03:18:18Z
QXag-irFHxE,Most Overpowered Guns In Ghost!,3873,126415,2013-11-11T20:11:15Z
vBEGODNmdas,Are Minecraft Faction Has A New Pet! (poopymiscquidlepants),3045,113563,2013-10-31T20:44:54Z
v3tbnlc5cfo,Battle Pirates!,4101,117715,2013-09-21T22:18:59Z
ObYLL97-SBA,How To Duplicate Diamonds!!!!,6655,188999,2013-09-15T01:09:42Z
IaR7P4-wFK8,50k Video Views!!!! EpicSauce!,9289,284085,2013-09-08T22:20:48Z
v1ELS84GQu8,If This Video Gets One Million Views.....,1172943,13301560,2013-09-07T02:28:05Z
ctJORnOjbrQ,These Were The Good Days....,4801,192601,2013-09-05T02:14:46Z
-hrPQFaDVKQ,Channel Update.,4878,194965,2013-08-16T20:34:58Z
bIZ5_L1ru2w,Funny Noob Tubing Reaction Montage!,3865,138096,2013-08-16T03:04:45Z
yyssjJEJMt4,Minecraft How To Grief Without Being Seen!,18131,360417,2013-08-14T21:39:31Z
2bwPntvb90U,Buried Round 50 Gameplay! Black ops 2 Zombies.,4647,151111,2013-08-12T22:49:16Z
Wz1VHTZq16c,Minecraft Let's Play Ep. # 2 - Having Fun and Derping!,7519,197936,2013-08-12T01:53:18Z
Cs-kyTJso-A,Worlds Biggest Ball Of TNT Minecraft!  Challenge Video!,19423,647372,2013-08-09T23:45:05Z
jkqd-oc0F00,How To Get A Gaming Partnership And What It Is.,3837,108083,2013-08-08T21:25:32Z
mVkT6Cd9SoI,Camping Montage.... LOL,3667,110583,2013-08-05T21:12:41Z
rffyxTTNkyk,Black Ops 2! Mini Update Video.,4225,107290,2013-08-05T02:55:37Z
OOesLeO6-pc,Randomness,4405,107325,2013-08-02T22:16:42Z
Q5lcjP6XlHw,203 Kill Game! Thanks For 300 Subscribers!,6245,171161,2013-08-01T19:36:50Z
sE3ZZmYotSs,Call of Duty Ghost Multiplier Reveal Trailer Release Date!,4288,129068,2013-07-30T20:51:42Z
pUwUAtmBKxw,Insane Black Ops 2 HACKER!!!!,6864,255724,2013-07-30T02:45:21Z
p5rGgPZtjDw,Top Subscribed To Channels? BO2 w/ commentary!,4776,132008,2013-07-28T20:50:09Z
bWDmDsdvoBs,Career Ender ....  LOL,4407,159167,2013-07-28T17:13:58Z
OJA1QK-j-Oo,I Bought A New Microphone!  (quality test),5334,169470,2013-07-27T23:25:01Z
KL1X8NsVGd0,Top 10 Worst Guns in Call Of Duty History!,7536,215516,2013-07-25T21:36:56Z
q2HoSwCMcZw,Black ops 2 Patch news!,5175,151057,2013-07-24T20:35:32Z
RRknlgRqOds,Black ops 2 Invisible equipment and scorestreak glitch!,5717,185446,2013-07-21T18:26:36Z
j93M46a-W3U,I'm Back! Update Video....,6955,204016,2013-07-19T23:41:14Z
uqjfMNEWNIg,Minecraft Let's Play! Ep. 1. The Beginning!,25210,715494,2013-07-08T20:03:41Z
X-g9aT2wFjM,Channel Trailer....,10215,285802,2013-07-06T18:17:45Z
pHKlrJeKmjA,Black ops 2 Shotgun gameplay w/ commentary....  Ps4 or Xbox?,6846,262291,2013-07-06T00:13:48Z
C82suucz4i4,Black ops 2 Gameplay w/ commentary. Hipsters,12307,372786,2013-07-03T17:48:10Z
H_DYlka7QAQ,Project Zomboid Let's Play ep [04] lots of stuff,5969,153212,2013-06-18T15:51:26Z
ov0KQthQ50U,Project Zomboid Let's Play ep. [03] Looting and storing.,5774,147259,2013-06-17T02:17:34Z
MC-7ziNt_U4,Project Zomboid let's play ep. [02] Just some chores.,6050,147675,2013-06-15T19:54:37Z
PNsF1Uh5yP8,Project Zomboid Lets Play ep [01] Roughing it out!,9178,259359,2013-06-15T00:03:38Z
9Y2sAtN5yRs,Gunpowder plus mod! (Grenade mod) Epic explosions for minecraft.,8275,230484,2013-04-21T18:04:39Z
-z349CGAOXs,Horse racing map for new update! (minecraft),8074,221604,2013-04-21T16:37:08Z
pl4xmh3RWfE,Amazing minecraft Cathedral!,14374,439198,2013-04-21T01:36:32Z
6z5RwrvnH28,Huge WW2 jeep! Minecraft creations.,19050,629265,2013-04-21T00:52:21Z
ivdQqobHDPc,Story time!,20823,638518,2013-04-18T01:54:48Z
uUIlb2rpIuY,Epic Minecraft city! (w/ download link!),11674,391602,2013-04-11T01:00:01Z
Ros1PpcO5Js,Pokemon online battle #9 [rb] Hidden power ice ftw!,7927,202233,2013-04-07T00:03:02Z
KYv1nqutbK0,Pokemon online battle #8 Stone edge,8977,195994,2013-04-05T01:21:12Z
7Yi-ctyTNU4,Online pokemon battle #7 [uu] 5-0,10390,250129,2013-04-04T01:43:46Z
VN2-3OfUzd8,Magic karp sweeps whole team of LEGENDARIES!!!,8028,205320,2013-04-01T23:26:03Z
-2IFrMOM36w,Pokemon online battles #5 [uu] Heracross never seems to dissapoint me...,9056,203905,2013-03-31T20:49:28Z
7dIFHQkrASM,This is a detailed break down of my favorite UU team... ENJOY!,8906,218307,2013-03-29T23:14:45Z
QicO1Gd0kvU,Pokemon online battle #4 [uu] Same old team,0,258693,2013-03-28T17:22:43Z
yFfcsmK2TOA,Online pokemon battle #3 [uu] Ice punch,0,216081,2013-03-27T19:57:08Z
Jl0-6tbNGBo,Pokemon online battle #2 [uu] Herracross w/ Dat MOXIE BOOST,0,316547,2013-03-26T16:58:32Z
IAbX0FwX-GY,Why I Haven't Been Uploading,0,862764,2013-03-25T20:10:38Z
XKSJRulqDNA,Most Epic Thing In Minecraft!?!?!?!?!?!!?????,18015,456310,2013-03-10T22:19:14Z
jysfHFHNjYQ,Epic minecraft apartment complex!,22949,576606,2013-01-27T18:25:46Z
Yox25V8Qsm4,Crazy Illulsions In Minecraft. (Bigre),25344,723958,2013-01-27T02:11:30Z
clcN3OA8SNw,Best Minecraft Castle Ever?,19896,422056,2013-01-27T01:52:40Z
m3lTwO0aNyw,How to get unlimited diamonds! minecraft (x-ray),25149,612316,2013-01-26T19:34:43Z
gchqnwXlxJw,Drinks in minecraft (mod),0,594002,2013-01-26T16:26:34Z
atCPtw4dg7g,Emerald tool mod! (minecraft),25837,573678,2013-01-23T22:34:58Z
t8aM4HuVLrQ,This is a block? Since when lol.,33947,898526,2013-01-21T22:30:09Z
M82VAcabSiA,Scary minecraft pig skin!,38003,1127585,2013-01-13T16:53:17Z
7qj3nuF9Dzw,Most Epic minecraft skin EVER  (Psy),44767,1274710,2013-01-13T01:59:21Z
Y74b7WlcEpk,More birds IN MINECRAFT!!,49649,1399480,2013-01-12T23:35:45Z
Z8nEEdXTaX0,Boxy item mod Minecraft.  EPIC,58635,1648316,2013-01-12T22:34:11Z
jP82d277Cc8,Harry Potter Mod In Minecraft! EPIC MUST SEE MOD!!!,0,6288393,2012-03-09T23:29:03Z
