video_id,title,likes,views,published_date
yWEUL3crU_E,I Baked a Cake In a Race Car,415590,20602980,2025-10-21T16:00:01Z
JgJrQnDIRgg,First to Answer the Phone Wins $10000,1133910,34203486,2025-10-17T16:00:00Z
gtkqnhN0VkU,Answer The Door Win $10000,1594344,48276321,2025-10-14T16:00:00Z
oBXSvS2QKxU,100 Kids Vs World's Strongest Man!,2330318,101195080,2025-10-11T16:00:00Z
UTdcX1e0cMA,Jump Over The Lava Win!,1519475,50336972,2025-10-10T16:00:01Z
oiZvK6MY7tI,Call Your Ex Win $10000,1825418,61716936,2025-10-07T16:00:00Z
F0OkwXKcPSE,Hi Me In 10 Years,3150728,43568215,2025-10-04T16:00:07Z
686PL7rt654,World’s Fastest Dinner Date,2863424,185093048,2025-10-03T16:00:03Z
zo7i8VTpfNM,Would You Risk Dying For $500000?,2003341,87298530,2025-09-27T16:00:04Z
NfhuGUyWYfQ,Would Your Grandma Go Skydiving?,2050092,67333950,2025-09-26T18:00:07Z
wIpWCJKfRXs,I Cooked A Pizza With Power Tools,5357429,261608212,2025-09-23T16:00:07Z
9Xeepzg1B8I,Which Celebrity Punches The Hardest?,2795929,123094067,2025-09-19T16:00:03Z
50G0kIty7Cg,Answer The Call Win $10000,4953906,213919914,2025-09-16T17:00:04Z
4l97aNza_Zc,Survive 30 Days Chained To Your Ex Win $250000,3368520,148732135,2025-09-13T16:00:01Z
3ih2bPKSWsQ,I Arrested IShowSpeed,1936031,59714120,2025-09-12T17:00:01Z
uA9Zcg3vHvo,I Raced IShowSpeed,6796617,337215929,2025-09-01T20:45:41Z
_AbFXuGDRTs,$1 vs $1000000000 Nuclear Bunker!,2607916,117704974,2025-08-30T16:00:11Z
MOGW3v3pJ5Y,1 Subscriber = 1 Penny Donated,22477255,561889390,2025-08-29T16:00:10Z
XNtTO_339kU,Pick The Wrong Tube Get Slimed,2236924,96446733,2025-08-27T16:00:02Z
rB9NynBZ4go,Reaction Time Challenge,1767459,106143117,2025-08-19T16:00:02Z
TDv56whosPQ,Survive 100 Days In Prison Win $500000,2870592,119672136,2025-08-16T19:00:02Z
R_BmT1OJw98,Every YouTube Play Button I Have,2033601,79192543,2025-08-15T16:00:01Z
vpRW4JhzfSE,1 Subscriber = 1 Second In The Arctic,2297093,64462746,2025-08-08T16:00:02Z
qXW93Cois2s,Guess What Hit You,1160575,64577085,2025-08-05T16:00:01Z
r7f0L48dHpc,$1  = One Year of Clean Water,3622073,116744104,2025-08-02T16:00:02Z
Z4hVGCWH1Kc,2000000 People Get Clean Water For The First Time!,2312849,77473391,2025-08-01T16:00:01Z
zxuICI0kL3s,Don’t Turn Around Win $10k,5893824,305144025,2025-07-31T16:00:01Z
R1SFXJo-FlE,Subscribe To Explode The TNT,2734459,91814659,2025-07-29T16:00:01Z
lQz5aqjZ3lQ,Find This Briefcase Win $10000,4859128,176971535,2025-07-25T16:00:02Z
EiFcNbXBqeo,Jet Engine vs Human for $10k,2038548,125616627,2025-07-20T16:00:01Z
pzBi1nwDn8U,Survive 100 Days Trapped In A Private Jet Keep It,3391867,133144961,2025-07-19T16:00:01Z
R7oW0LwS_e4,I Met Neymar,1651789,96137827,2025-07-11T16:15:07Z
BfKI_TQnQvo,I Raced A Cheetah,2951862,124836939,2025-07-06T16:00:01Z
FWAdfuPpLOc,World's Fastest Car Vs Cheetah!,3309008,179963310,2025-07-05T16:00:01Z
NjlP2_l1Wr0,You Lose You Get Shot,1614204,95859455,2025-06-30T16:00:08Z
gGcaGdHlt60,If You Spill You Lose!,3488726,374382253,2025-06-25T17:00:08Z
pe_ejTiIcSs,Lose 100 LBs Win $250000!,6403023,205378750,2025-06-21T16:00:01Z
V6In4tmd-w8,$1 vs $25000 VFX,2238293,88507753,2025-06-19T17:00:41Z
ZGvn9ywXjpY,Feastables vs Reese’s Taste Test with @gordonramsay,5595858,294035337,2025-06-10T16:00:02Z
hTSaweR8qMI,$1 vs $500000 Date,3346375,145209635,2025-06-07T16:00:00Z
KCRLP-zBacU,Can I Teach a Penguin To Subscribe?,6528342,314533714,2025-05-31T16:10:27Z
c2ukL_zjFCk,Extreme Helmet Game,3312283,175109636,2025-05-28T16:00:19Z
DZIASl9q90s,Beat Neymar Win $500000,3512396,154177729,2025-05-24T16:00:01Z
7qY-qalCI2Y,Grab The Rolex Keep It!,2910570,190016127,2025-05-21T15:59:50Z
N0pwLtonPdg,Slippery vs Sticky Stairs,7782996,702620592,2025-05-16T16:00:01Z
-4GmbBoYQjE,I Survived 100 Hours In An Ancient Temple,2906157,118363629,2025-05-10T16:00:01Z
0yPgljFcTR4,Subscribe to Win $50000,4152354,84450909,2025-05-07T16:00:01Z
TN1wErFGTzM,Find This Key Win $10000,1544286,49774924,2025-05-05T16:00:00Z
3dxksf0CzS8,World’s Fastest Robbers,5201282,233424681,2025-05-02T16:00:00Z
x7yv72s8h0o,Would You Go On Vacation With A Stranger?,7822994,253697673,2025-04-29T16:00:00Z
uyiG6uw-6pA,Would You Risk Drowning for $500000?,3152396,190365546,2025-04-26T16:00:00Z
M1STzb7k9L8,Extreme Helmet Game,2230279,205274448,2025-04-25T16:15:00Z
7K-yxGWYsnk,$10000 Human Shuffleboard,5914535,485187474,2025-04-22T16:30:14Z
Tbn4cYCaZCk,Drift This Car Win $10000,6305060,468295112,2025-04-16T17:00:15Z
figrl0aOULs,Click This Video To Feed 1 Person,4226480,73106690,2025-04-12T16:00:01Z
Uxc84UUrVHk,You Can Stop Child Labor,3566561,89032554,2025-04-11T16:00:01Z
BzKaMelDzqo,How Fast Can I Go?,2759678,171758328,2025-04-05T16:00:12Z
4yx9ZJDfyKk,Baseball Tic Tac Toe vs MLB Pro,1539231,65640082,2025-03-27T16:00:00Z
kPa_S6jN9ls,Could You Win This Obstacle Course?,1724627,90950864,2025-03-25T16:15:01Z
69g-YcbmgQA,Find Your Dog Win $10000,11159298,450065342,2025-03-23T16:00:01Z
aKq8bkY5eTU,I Survived The 5 Deadliest Places On Earth,3153475,158013153,2025-03-22T16:00:00Z
TNtpUQbW4mg,This Is How The Pyramids Were Built,7929698,306458766,2025-03-18T16:00:00Z
TgCm8oDmxOk,I Crashed One Of The Most Expensive Cars In The World,2464143,101592507,2025-03-14T16:00:00Z
954wJ3uHVAk,Last One To Fall Wins,3892535,132708162,2025-03-08T18:05:23Z
zajUgQLviwk,Last to Leave Their Circle Wins $500000,3056928,190640127,2025-03-01T17:00:01Z
PXevNM0awlI,Highest Away From Me Wins $10000,11048956,502869626,2025-02-28T17:00:00Z
PuQ5UxKUY48,Find The Human Win $10000,7136930,311673020,2025-02-24T17:00:02Z
L5ihmu87xTE,Find This Stranger Win $10000,15749066,592869071,2025-02-19T18:00:00Z
nAiKLoCP-kU,Reach the Money Win $10000,7517898,472467922,2025-02-14T18:15:00Z
NDsO1LT_0lw,I Spent 100 Hours Inside The Pyramids!,5329625,219008011,2025-02-08T17:00:00Z
sF5LYGgKbUA,Every Minute One Person Is Eliminated,3027317,143697462,2025-01-25T17:00:01Z
MFpWEKN9c6Y,Last Person Hanging Wins $10000,12526656,524704900,2025-01-21T17:00:03Z
TRxMLLuWIhw,Subscribe For An iPhone,28164135,283630878,2025-01-17T17:00:00Z
SM66GDRyIVY,I Helped 2000 People Walk Again,2954719,123756681,2025-01-11T17:00:02Z
EvqtfK_RaRg,This obstacle course is WILD,3847754,203930533,2025-01-10T17:00:00Z
3cWm9B_0_kI,How Many People To Stop Ronaldo?,11624148,501942450,2024-12-27T19:00:00Z
qtWqHIx8Z-o,Last Person Standing Wins $10000,12997274,616241231,2024-12-22T17:00:01Z
gs8qfL9PNac,2000 People Fight For $5000000,4573790,184738126,2024-12-19T17:00:00Z
DBPYB8WkkDc,Bring Me Back Snow From The North Pole,17904726,643148956,2024-12-10T17:00:00Z
zvBXpoBegwE,I Got T-Series To Subscribe To Me,8001765,185975009,2024-12-09T17:00:01Z
SWc8fI_9iqA,Ronaldo Teaches Me How To SIUU,9126156,324525905,2024-12-01T17:00:00Z
0BjlBnfHcHM,Beat Ronaldo Win $1000000,8104524,329928415,2024-11-30T17:00:00Z
HcL1EQ5qD_g,Confronting Ronaldo,12352321,228537853,2024-11-29T17:30:10Z
dc089EZRGcg,How Many Balloons To Make A Store Fly?,10431976,459199432,2024-11-18T19:00:00Z
vXNtju4VFm4,Restocking MrBeast Labs at Walmart,5748903,343197155,2024-11-18T17:00:00Z
I9mw5UlDyPI,This Game Is Wild...,13265262,655733780,2024-11-12T17:00:00Z
pS-fFdvyHLE,How Much Tape To Stop A Lamborghini?,13844451,730284571,2024-11-08T17:00:00Z
Xj0Jtjg3lHQ,$1 vs $500000 Experiences!,5098345,265225663,2024-11-02T16:00:00Z
9UtcHPCEBgg,1 Subscriber = 1 Penny,16991358,377430313,2024-10-19T18:00:00Z
ZNt_GoOBHq8,Human vs Jet Engine,13310419,522382685,2024-10-17T19:00:00Z
bn0Kh9c4Zv4,7 Days Exploring An Underground City,3672350,164975953,2024-10-12T16:00:00Z
dDVFnfCwjHA,Will A Basketball Boat Hold My Weight?,9973707,371467012,2024-10-11T16:00:01Z
Kt2HvqRruHQ,Find The Real MrBeast Win $10000,10165947,329979075,2024-10-05T16:00:00Z
vDrSCXFMAKk,Spot The Difference Win $10000,8260218,262323773,2024-09-28T20:00:00Z
snX5YyflrGw,100 Identical Twins Fight For $250000,3327124,180433789,2024-09-28T16:00:00Z
nbzQdlWrcnk,Running With Bigger And Bigger Lunchlys,8164770,323269656,2024-09-20T16:00:00Z
8krJy31Diow,Holding Bigger And Bigger Dogs,7931935,310412453,2024-09-16T18:00:00Z
aRcUVhVlSHg,Men Vs Women Survive In The Wilderness For $500000,4264802,206277097,2024-09-07T16:00:00Z
Jo7sfpeWqwE,Will A Guitar Boat Hold My Weight?,18132741,756777968,2024-09-05T16:00:01Z
QtD-CeUdRUQ,Real Or Cake For $10000,7726213,232389394,2024-08-29T16:00:00Z
ndAQfTzlVjc,7 Days Stranded In A Cave,4548410,163818940,2024-08-17T16:00:00Z
AydS-vA3qa4,Running With Bigger And Bigger Feastables,12075806,422562008,2024-08-15T23:00:00Z
UPrkC1LdlLY,Survive 100 Days In Nuclear Bunker Win $500000,6127915,329096006,2024-08-03T16:00:00Z
8bTQMDM4qvY,Spot The Fake Animal For $10000,16913354,592978492,2024-07-19T16:00:00Z
DBw0oD38z0Q,This Game Is Wild,6187755,229918588,2024-07-17T16:00:00Z
4SNThp0YiU4,50 YouTubers Fight For $1000000,9559976,416680589,2024-07-13T16:00:01Z
XhuisK0bTSA,Pass The Phone To…,11242888,266531541,2024-07-11T17:00:01Z
lkCRPp7cnP8,How Many Balloons Does It Take To Fly?,20321745,529845455,2024-07-10T17:00:00Z
KkCXLABwHP0,I Built 100 Houses And Gave Them Away!,7834115,226747934,2024-06-29T16:00:00Z
PWirijQkH4M,World’s Deadliest Obstacle Course!,6684170,375972949,2024-06-15T16:00:01Z
U_LlX4t0A9I,$10000 Every Day You Survive In The Wilderness,8577061,319007811,2024-06-01T16:00:00Z
T8I165Qxeo8,Sprinting with More and More Money,11901913,313041413,2024-05-30T16:00:01Z
i-9V21MqlhY,Giving 1000 Phones Away,23251580,382054368,2024-05-28T16:00:00Z
YyNz4--6fro,World’s Smartest Dog,10234988,248502008,2024-05-16T16:00:00Z
f0cXJ6mJxGc,Bottle Head Smashing World Record Attempt!,12480858,495204308,2024-05-14T16:00:00Z
F6PqxbvOCUI,Protect The Yacht Keep It!,4199197,163313280,2024-05-11T16:00:00Z
oA4LSZvX4iE,Ages 1-100 Try My Chocolate,9850619,270682801,2024-05-09T16:00:00Z
ZKxnjszkZto,Spot The Hidden People For $10000,6401242,197797740,2024-05-08T16:00:01Z
8_gdcaX9Xqk,Would You Split Or Steal $250000?,11440368,209587918,2024-05-03T16:00:00Z
snUyLbGx6U4,Buy Feastables Win Unlimited Money,12404548,390172858,2024-04-30T16:00:00Z
Pv0iVoSZzN8,In 10 Minutes This Room Will Explode!,4155798,161650786,2024-04-27T16:00:00Z
CWbV3NItSdY,The World's Fastest Cleaners,26192031,689772152,2024-04-25T16:00:03Z
l-nMKJ5J3Uc,Ages 1 - 100 Decide Who Wins $250000,6186170,297819743,2024-04-20T15:59:59Z
XE1Qyss8GIY,Guess The Gift Keep It,19029852,534400166,2024-04-09T17:00:00Z
6GzHPS0rEgc,I’m Giving My 250M Subscriber $25000,10205255,295194454,2024-04-06T19:45:00Z
imhY0pe-Sd8,Anything You Touch You Keep!,10257926,257940462,2024-04-02T16:00:03Z
erLbbextvlY,7 Days Stranded On An Island,7341160,427256206,2024-03-30T16:00:01Z
OnTTThIzuNU,Keep Track Of Car Win $10000,7853834,173148628,2024-03-19T16:00:00Z
mKdjycj-7eE,Stop This Train Win a Lamborghini,5353587,237978331,2024-03-16T16:00:00Z
tWYsfOSY9vY,I Survived 7 Days In An Abandoned City,6575907,311145367,2024-03-02T17:00:00Z
sH48lKbayNU,Unboxing My 200M Subscriber Play Button,14320741,238275150,2024-02-29T17:00:00Z
AFXoSFNMwIA,I Filled Chandler’s Car With Feastables,14231578,399689751,2024-02-27T18:00:01Z
k194wHZHjB0,Most Expensive Hand Model Holds Feastables,11964820,574521477,2024-02-24T18:00:09Z
AjwAdtlRKf8,Buy Feastables Win $10000,15937782,428583833,2024-02-17T19:00:01Z
KOEfDvr4DcQ,Face Your Biggest Fear To Win $800000,6574116,353639761,2024-02-10T17:00:00Z
krsBRQbOPQ4,$1 vs $250000000 Private Island!,5821308,356031259,2024-01-27T17:00:00Z
7ESeQBeikKs,Protect $500000 Keep It!,4770030,185302948,2024-01-13T17:00:00Z
K_CbgLpvH9E,I Spent 7 Days In Solitary Confinement,5376823,263045247,2023-12-30T17:00:03Z
lOKASgtr6kU,I Adopted 100 Dogs!,6518947,353383519,2023-12-23T17:00:00Z
9RhWXPcKBI8,Survive 100 Days Trapped Win $500000,6807746,424746842,2023-12-16T17:00:01Z
ZVt9ZJfWV1c,Feeding A Dog $1 vs $10000 Steak,15312023,538736953,2023-12-14T18:00:00Z
rWBOITBjitE,Could You Walk Up A Skyscraper?,15134990,441118697,2023-12-05T18:00:00Z
tnTPaLOaHz8,$10000 Every Day You Survive In A Grocery Store,7274686,463840299,2023-12-02T17:00:00Z
Wdjh81uH6FU,$1 vs $10000000 Job!,4805337,289151798,2023-11-25T17:00:00Z
7dYTw-jAYkY,I Spent 7 Days Buried Alive,7846908,278069724,2023-11-18T17:00:01Z
AjZDwxt7S8w,I Gave Away A House On Halloween,13495477,335168768,2023-11-10T18:00:00Z
aZnqqXaT02g,Giving Car Keys Instead Of Candy On Halloween,10680991,367415666,2023-11-09T18:00:00Z
mwKJfNYwvm8,I Built 100 Wells In Africa,10362648,254373452,2023-11-04T16:00:00Z
l9_8_pDTmis,Furthest Away From Me Wins $10000,21449951,649029324,2023-11-02T17:00:03Z
n7x4Jj9pdH8,World’s Most Expensive Bed,21267354,509816615,2023-10-31T17:00:01Z
QjvpjXdgugA,10 People Vs World's Deadliest Laser Maze for $250000,4794816,287211026,2023-10-28T15:59:59Z
jGAJCAuV3pQ,World’s Most Expensive Coffee,11264568,269111391,2023-10-19T17:00:03Z
c0v8OPItCOg,$100000000 Bathroom,12525603,346372016,2023-10-17T17:00:00Z
3ryID_SwU5E,$1 vs $100000000 House!,6321247,384386464,2023-10-14T16:00:00Z
IemzxkkzI5s,I Tipped A Pizza Delivery Driver A Car,26212082,644636796,2023-10-12T17:30:03Z
3OFj6l2tQ9s,World's Most Dangerous Trap!,6673926,323748371,2023-10-07T16:00:00Z
bvlFjrcpD6s,I NEED 1 MORE 𝗦𝗨𝗕𝗦𝗖𝗥𝗜𝗕𝗘𝗥,30434781,461233732,2023-10-05T17:00:01Z
AZlBZuS4hr0,Guess The Gift Keep It,25218531,886583161,2023-10-03T17:00:00Z
Gx6VeIIbWwM,Spot The Hidden People For $10000,21760693,730463635,2023-09-28T17:00:01Z
CAOY8EKH1qU,I Paid A Random Student’s College Tuition,24489616,468858676,2023-09-26T16:59:59Z
IQxea9UB1nQ,$100000000 Car Doors,29251072,1210739017,2023-09-19T17:00:00Z
KrLj6nc516A,$1 vs $100000000 Car!,7859765,497050388,2023-09-16T16:00:01Z
zgLhCT7aFCA,Extreme Home Makeover!,19605465,389094010,2023-09-12T17:00:00Z
L5kIXRdwGAI,Katana Vs Bullet,37597382,1087048027,2023-09-07T17:00:01Z
19NmWqv4Alk,How Many School Buses Can We Stack?,15446338,492354464,2023-09-05T16:59:57Z
vBpQ1SlfVtU,Lamborghini Vs World's Largest Shredder,5688778,251476943,2023-09-02T16:00:00Z
SGzWIoLAzmY,Feeding A Cat $10 Vs $10000 Sushi,13720830,372832486,2023-08-31T17:00:00Z
NnNZLCl78Ao,Make This Kick Win Super Bowl Tickets,5202852,138804346,2023-08-25T16:00:25Z
NTZhwAldqwg,Metal Pipe Vs School Bus,13804589,515992321,2023-08-22T17:00:00Z
J_z-W4UVHkw,Every Country On Earth Fights For $250000!,6408898,246648606,2023-08-19T16:00:01Z
mKIhHNznt4s,Can You Beat A Girl In Arm Wrestling?,20914412,552771857,2023-08-17T17:00:00Z
jObOjhUkf50,$1 vs $250000 Vacation!,6648903,389422540,2023-08-12T15:59:59Z
O3YVBJ2n5xg,I Ate The World’s Most Poisonous Fish,21692827,489410885,2023-08-08T17:30:01Z
yhB3BgJyGl8,7 Days Stranded At Sea,8186616,395354509,2023-08-05T16:00:01Z
CP82DAKzL1U,I Traded My Car At a Red Light,26408906,660046749,2023-07-15T17:00:01Z
fuhE6PYnRMc,Train Vs Giant Pit,6567299,281681323,2023-07-08T16:00:00Z
stUofW3whpE,I Buried Treasure in the Bermuda Triangle,25433286,489664565,2023-07-06T17:00:01Z
48h57PspBec,$1 vs $1000000000 Yacht!,8172531,503132930,2023-06-10T16:00:00Z
ooAwCOP67GQ,Do Pawnshops Scam You?,16269368,410474351,2023-06-03T16:59:57Z
FM7Z-Xq8Drc,Ages 1 - 100 Fight For $500000,6708569,444026344,2023-05-27T21:14:59Z
ykRq_rp7NhM,I Got Naruto to Subscribe to Me,13328840,312833158,2023-05-20T20:00:00Z
WTOm65IZneg,1000 Deaf People Hear For The First Time,5502050,204814753,2023-05-06T19:59:59Z
8kggT2ej-lo,Would You Pet a Cheetah in Africa?,28210766,855542690,2023-05-01T20:00:02Z
GGBy50KtvRk,Tipping A Waitress A Car,28930071,665622248,2023-04-22T20:00:00Z
Y4-gFIfGXiQ,Would you go on a Blind Date in Italy?,23789162,547640512,2023-04-15T20:00:01Z
1WEAJ-DFkHE,World's Most Expensive Flights!,8806941,522933636,2023-04-01T20:00:04Z
Y0cBiGUuB1Y,I Sent a Subscriber to Disneyland,29976423,635492584,2023-03-30T20:00:00Z
YLt73w6criQ,I Paid A Real Assassin To Try To Kill Me,6376323,320845525,2023-03-18T20:00:01Z
NPYPXWJBTWM,$10000 Girl Scout Cookies,13634686,617388787,2023-03-11T17:00:47Z
lglIQkCHO0g,Do Men Lie About Their Height?,21385460,546439897,2023-02-14T21:00:14Z
TJ2ifmkGGus,1000 Blind People See For The First Time,10396780,209578635,2023-01-28T21:00:00Z
7IKab3HcfFk,I Survived 50 Hours In Antarctica,5782830,246099829,2022-12-24T20:59:59Z
h5NvTTOlOtI,Hydraulic Press Vs Lamborghini,5782427,261578823,2022-12-10T21:00:01Z
se50viFJ0AQ,Would You Fly To Paris For A Baguette?,57044463,1629839299,2022-12-08T20:12:27Z
0CTp1a-aCUM,100 Kids Fight Parents For $500000,4880367,322448438,2022-12-03T21:00:00Z
FD-0KG-h2-c,Gordon Ramsay Tries Most Expensive Chocolate Bar!,30209835,796269530,2022-11-19T20:59:59Z
kX3nB4PpJko,11 YouTubers Fight For Private Jet!,4925495,241548536,2022-11-12T21:00:00Z
YlvcFJOE-OE,Giving iPhones Instead Of Candy on Halloween,40486573,1577333037,2022-11-02T21:00:01Z
iogcY_4xGjo,$1 vs $1000000 Hotel Room!,7455286,415375878,2022-10-22T21:00:00Z
S_CUEOBZ0P4,The Rock Vs MrBeast For $100000,35916820,692006154,2022-10-21T20:00:06Z
gHzuabZUd6c,Survive 100 Days In Circle Win $500000,6268931,380921248,2022-09-24T19:59:59Z
65fN_OUawjk,I Hunted 100 People!,3987848,254511847,2022-09-03T19:59:59Z
jdMNoQE3mIQ,Can I Survive A Plane Crash?,4250817,226148768,2022-08-20T20:00:00Z
2isYuQZMbdU,100 People Fight For A Private Island,7107899,248433504,2022-08-04T19:59:59Z
tVWWp1PqDus,100 Boys Vs 100 Girls For $500000,4991615,282804052,2022-07-23T20:00:09Z
vaIgyRoUkQI,I Didn’t Eat Food For 30 Days,4275318,125366965,2022-07-02T20:00:02Z
Hwybp38GnZw,I Built Willy Wonka's Chocolate Factory!,6906603,362213489,2022-06-04T20:00:02Z
hD1YtmKXNb4,$10000 Every Day You Survive Prison,5619921,242984770,2022-04-09T20:00:00Z
LnlKwzc_TNA,Would You Swim With Sharks For $100000?,4180952,205177859,2022-03-19T20:02:32Z
3jS_yEK8qVI,World’s Most Dangerous Escape Room!,5579161,288347694,2022-01-29T21:00:01Z
00NgUctWoLQ,Extreme $1000000 Hide And Seek,3656665,109895847,2021-12-18T21:00:00Z
x9TQ6culXIA,World's Biggest YouTubers Fight for $1000000,3139359,103463860,2021-12-16T21:00:00Z
QbJJwaVdgIs,I Got Hunted By The Military,4816774,254855328,2021-12-10T21:30:02Z
0e3GPea1Tyg,$456000 Squid Game In Real Life!,19751226,882439245,2021-11-24T21:00:01Z
cV2gBU6hKfY,I Cleaned The World’s Dirtiest Beach #TeamSeas,5612551,133691158,2021-10-29T19:59:43Z
qIsgdOVGA04,Last To Take Hand Off Lamborghini Keeps It,4810608,198338508,2021-10-23T20:00:01Z
cExLQ1o2pDw,First To Rob Bank Wins $100000,4548379,210019857,2021-09-26T20:00:06Z
uocETPj4Jx4,Extreme $500000 Game Of Tag!,4775716,224932495,2021-09-04T20:00:07Z
zxYjTTXc-J8,Last To Leave Circle Wins $500000,7789572,537268650,2021-08-31T20:01:03Z
hxwpkM5w3Cc,I Got Hunted By The FBI,4834630,257225457,2021-08-07T23:00:03Z
ktyJIj6i4Qw,If You Can Carry $1000000 You Keep It!,3918949,255141730,2021-07-24T20:00:59Z
urtFrxDUV6c,Would You Quit School For $100000?,3690515,187641668,2021-07-10T20:00:09Z
nM89Wl03Q4g,I Survived 50 Hours In A Maximum Security Prison,4438495,290956273,2021-06-26T20:00:02Z
NZlClr_ivb4,Hit The Target Win $300000,3773692,212772638,2021-06-12T20:00:01Z
E6E22XQPhhg,Anything You Can Fit In The Triangle I’ll Pay For,3645062,261071623,2021-06-01T20:00:02Z
TQHEJj68Jew,I Got Hunted By A Real Bounty Hunter,4359621,233733435,2021-04-24T20:00:00Z
WcwGleN38zE,Extreme $100000 Game of Tag!,3991492,266184841,2021-04-17T20:00:00Z
fMfipiV_17o,Would You Sit In Snakes For $10000?,5746095,371577303,2021-04-10T21:00:07Z
ayXxwJJId_c,I Bought The World's Largest Mystery Box! ($500000),5517591,289012260,2021-04-03T20:00:01Z
9bqk6ZUsKyA,I Spent 50 Hours Buried Alive,8342869,336759131,2021-03-27T20:00:04Z
DuQbOQwVaNE,Offering People $100000 To Quit Their Job,3534537,167756911,2021-03-13T21:00:02Z
vJH28ICkCdU,I Sold My House For $1,4034710,181492435,2021-03-06T21:00:02Z
_uwNDiU04zE,I Donated $300000 To People In Need,3022008,56761623,2021-02-13T21:00:01Z
C680oxL__ck,I Ate $100000 Golden Ice Cream,6124791,297264927,2021-01-22T21:00:03Z
5Fg9oZk-5uA,I Bought Everything In 5 Stores,5693902,201877814,2021-01-09T21:01:25Z
PKtnafFtfEo,YOUTUBE REWIND: 2020,5030334,73148948,2021-01-01T21:00:03Z
f0c7pSCoZqE,I Put 1000000000 Christmas Lights On A House (World Record),2997018,131978648,2020-12-23T21:00:06Z
dg2Ag3e8W-Q,I Opened A Restaurant That Pays You To Eat At It,5175618,201708345,2020-12-19T22:00:03Z
LeYsRMZFUq0,I Gave People $1000000 But ONLY 1 Minute To Spend It!,7025672,236242280,2020-12-15T21:00:11Z
Dc2ZRmuH5OM,Steal This $100000 Diamond You Keep It,3693816,228906108,2020-11-28T21:00:04Z
GLoeAJUcz38,Press This Button To Win $100000!,4821710,353467655,2020-11-14T21:00:02Z
SZQhgExjBvQ,I Survived 24 Hours Straight In Ice,4254107,181253982,2020-10-29T20:17:44Z
IoZri9hq7z4,I Uber’d People And Let Them Keep The Car,4201585,150823463,2020-10-24T20:00:01Z
vp5sSqyZ5Go,I Filled My Brother’s House With Slime & Bought Him A New One,4112673,257056949,2020-10-10T20:00:31Z
AKJfakEsgy0,Hi Me In 5 Years,7328819,145779384,2020-10-04T20:00:54Z
Vl3swga-Xrk,Would You Rather Have A Giant Diamond or $100000?,3070668,201837502,2020-09-26T20:40:02Z
UE5AHE2Ypr8,I Gave My 40000000th Subscriber 40 Cars,4848926,208305197,2020-09-19T20:00:02Z
TDiXxsQ0w2Q,Why I Haven’t Been Uploading,2790240,59259292,2020-09-17T20:00:05Z
oD155zWANQg,Get This Random Person 1000000 Subscribers,2651593,87532643,2020-09-05T20:00:17Z
s1ax8Tx_Jz0,Would YOU Rather Have A Lamborghini or This House?,4149996,229524516,2020-08-22T20:00:01Z
NkE0AMGzpJY,Last To Leave $800000 Island Keeps It,5870292,290951509,2020-08-15T20:00:02Z
FbM1yi4mMMc,I Bought A Private Island,3992013,182710653,2020-08-13T20:00:07Z
5V2B28OqfqM,I Spent $1000000 On Lottery Tickets and WON,3395213,149348199,2020-08-08T20:00:02Z
Rj_vssRaZlQ,I Ate The World’s Largest Slice Of Pizza,4844668,318583031,2020-08-01T20:00:02Z
YQDDm9HLkV4,I Adopted EVERY Dog In A Dog Shelter,5009112,272793157,2020-07-23T20:00:11Z
erQ_9yEz0ls,$1 vs $100000 Firework!,5459229,253720203,2020-07-03T21:00:20Z
OAbP-V6fEVc,I Broke Into A House,3952692,207480009,2020-06-25T20:00:00Z
_qAJMXfL6o0,Would You Rather Have $100000 OR This Mystery Key?,4216348,273051664,2020-06-13T20:00:01Z
59AYXzCa-Cs,I Built The World's Largest Lego Tower,3622096,213138847,2020-06-06T20:00:01Z
r7zJ8srwwjk,I Spent 50 Hours In Solitary Confinement,5090914,337641941,2020-05-30T20:10:08Z
YSoJPA8-oHc,If You Click This Video I'll Give My Friend .001$,7535029,226551209,2020-05-23T21:01:02Z
5Hg_QSIJm8I,I Gave $200000 To People Who Lost Their Jobs (Corona Virus),1405403,47328811,2020-05-07T19:59:59Z
gsWPpE4Rid0,Videos I Could Not Upload...,4127835,173541146,2020-04-30T20:00:08Z
HBMmK1c44sE,I Spent 24 Hours In A Doomsday Bunker,3431045,227973295,2020-04-11T20:00:00Z
oBYbxw8f5OI,Giving $1000000 Of Food To People In Need,1955895,68241797,2020-03-27T20:00:05Z
AiGKBNGlzHo,I Ran A Marathon In The World's Largest Shoes,3538239,187431548,2020-03-21T20:00:02Z
_mdKvblL_8s,$70000 Extreme Hide And Seek - Challenge,2804742,159895222,2020-03-13T20:00:04Z
yXWw0_UfSFg,Anything You Can Fit In The Circle I’ll Pay For,5304434,327269515,2020-03-07T21:00:00Z
F4Y3Pkn95GI,I Ate A $70000 Golden Pizza,4476513,280919941,2020-02-29T21:00:22Z
KSKJKLmAqpI,Lambo Race Winner Keeps Lambo,2756066,150647414,2020-02-08T21:00:02Z
IYVjOfoU3uI,I Gave My Credit Card To Random People,4119516,200198438,2020-02-01T21:00:01Z
oI6aXhowFDY,Get Every Boy Scout Badge Win $10000,2314017,130193085,2020-01-25T21:00:01Z
LdMx2U5tby0,$60000 Extreme Hide And Seek - Challenge,2971324,175391069,2020-01-17T21:00:01Z
fY-LA3YaZ_M,How I Gained 15000000 Subscribers In 1 Year,897199,19739843,2020-01-03T21:10:01Z
0hVZOJCYBBM,Important Youtube Announcement (please watch),2421162,39213163,2019-12-28T21:00:06Z
Z9WQy9jEY8M,Giving 10000 Presents To Kids For Christmas,3150926,81781688,2019-12-23T21:00:04Z
bs0SWXbty18,Spending $1000000 In 24 Hours,4850567,206260180,2019-12-21T21:00:01Z
yeqARWqjkps,Last To Take Hand Off $1000000 Keeps It,3452844,148364819,2019-12-19T21:00:12Z
wMuYiLby3-s,Last To Stop Riding Bike Wins $1000000 (Part 4),1505551,68470095,2019-12-14T20:59:57Z
NbaWrbJDr48,Last To Leave Toilet Wins $1000000 (Part 3),1964787,104372550,2019-12-07T21:11:07Z
sfv1QaRzJg8,I Ordered Pizza And Tipped The House,4404270,157718096,2019-12-05T21:00:02Z
RwnN2FVaHmw,Last to Stop Swinging Wins $1000000 (Part 2),2382201,147000911,2019-11-30T21:00:03Z
X1jMMFOqxEw,$50000 Game Of Extreme Hide And Seek - Challenge,3118475,167942886,2019-11-28T21:00:01Z
ORUX1lHbOa8,I Opened A FREE BANK,3043188,128099487,2019-11-23T21:00:17Z
LU_xVr4b2qM,Going Around A Ferris Wheel 1000 Times Straight,2626298,132685862,2019-11-16T21:00:47Z
tQ4m4zD7BBA,Last To Fall Wins $1000000 (Part 1),3169460,168559830,2019-11-14T21:00:31Z
D9lVNzyhYnc,Surviving 24 Hours Straight In The Bermuda Triangle,4457621,263729435,2019-11-09T21:00:55Z
jokVbbLqV_E,I Spent $100000 On Lottery Tickets And Won!,1433909,58041217,2019-10-31T20:00:02Z
HPJKxAhLw5I,Planting 20000000 Trees My Biggest Project Ever!,4549058,117315450,2019-10-25T19:01:01Z
Ims5p6wjW9s,Last To Take Hand Off Boat Keeps It,2155206,136280067,2019-10-19T20:06:01Z
anFxsa5jXrE,I Searched 100 Dumpsters Here's What I Found,3188098,230454703,2019-10-12T20:10:01Z
QxGVgXf_LNk,Going Through The Same Drive Thru 1000 Times,5208399,309521603,2019-10-05T20:00:08Z
al6130OD1Ck,Donating $100000 To Random Streamers,1910944,66935160,2019-09-28T20:29:58Z
d1010B3sKNQ,Surviving 24 Hours Straight In A Rain Forest,2714299,144614941,2019-09-21T21:00:00Z
NS3hse9ezik,Last To Leave Ramen Noodle Pool Wins $20000,1602437,78044325,2019-09-13T20:00:05Z
npDey6_9YRs,Anything You Can Carry I'll Pay For #2,1745478,90984662,2019-09-06T20:00:00Z
0NGWT9COcEI,I Gave My Brother 24 Hours To Spend $100000,2584533,107688189,2019-08-31T20:00:01Z
3LLnjRLrvLU,I Opened A Free Car Dealership,3534096,152927529,2019-08-29T20:00:00Z
bTrV5v7GLcQ,Last To Leave Pool Of $20000 Keeps It,3359929,186797547,2019-08-24T20:00:01Z
lBYC4_Lccjw,Surviving 24 Hours On A Deserted Island,3659440,211866242,2019-08-22T20:00:07Z
